Transcription;Emotion;Sentiment;Emotion digits;Sentiment digits;Transcription tokens
Да. Подожди, как терракт? Подожди, Подожди, Даша туда поехала. Даша поехала туда с утра, она сказала, что, ну, как бы эти. Сейчас, подожди, она в 9 утра поехала туда, и у неё же. Ой, подожди, стой. Стой, у неё же, у неёё же, у неё, у неё подожди . а, у неё телефон разрядился, ты понимаешь. Это. Нет, у неё разряжался телефон, оставалось мало процентов, она же, она же боится. Она, у неё паника начинается, когда вокруг . Если она увидит человека;страх;негатив;5;0;подождать терракт подождать подождать даша туда поехать даша поехать туда утро сказать подождать 9 утро поехать туда она ой подождать стоить стоить она неёё она она подождать она телефон разрядиться понимать это она разряжаться телефон оставаться мало процент бояться она паника начинаться вокруг увидеть человек
Кристин. Слушай, сейчас в центре терракт случился, возле Эйфелевой башни. Там взорвали 4 здания. Там просто толкучка, куча погибших и раненых. Как. Вот так - терракт. Чего!? Как Даша поехала!? Во сколько ты с ней созванивалась? Слушай, она же не сможет сама никуда поехать! Она... Боже мой! Слушай у неё же нога ещё болит сегодня, как... Она же вообще там с ума сойдёт. В смысле, ты ей сейчас звонишь!? У неё зарядка есть с собой? Так . Что нам делать? Подожди, подожди, подожди, что нам сейчас делать? Давай.;страх;негатив;5;0;кристин слушать центр терракт случиться возле эйфелевый башня взорвать 4 здание просто толкучка куча погибнуть раненый терракт даша поехать сколько созваниваться слушать смочь сам никуда поехать ... бог слушать она нога ещё болеть сегодня ... вообще ум сойти смысл звонить она зарядка себя мы делать подождать подождать подождать мы делать давать
Подожди, какой теракт? Подожди, Даша туда уехала с утра. Ну Даша поехала прямо туда, на площадь, к Эйфелевой башне! У неё да, есть с собой телефон. Подожди, у неё на телефоне мало зарядки, ты Подожди, она, она же не может А если её убили!? Да, подожди. ;страх;негатив;5;0;подождать теракт подождать даша туда уехать утро даша поехать прямо туда площадь эйфелевый башня она себя телефон подождать она телефон мало зарядка подождать её убить подождать
Кристин, сейчас в центре случился терракт. Возле башни Эйфелевой. Там просто тысячи людей погибших и ещё больше раненых. Там просто цепи взрывов произошла. Как Даша уехала? Она брала телефон с собой? Точно? Она брала зарядку с собой, нет? Слушай, она же сейчас паниковать же начнёт, подожди. А если у неё опять приступ эпилепсии случится? Что делать, боже мой?;страх;негатив;5;0;кристин центр случиться терракт возле башня эйфелевый просто тысяча человек погибнуть ещё раненый просто цепь взрыв произойти даша уехать брать телефон себя точно брать зарядка себя слушать паниковать начать подождать она приступ эпилепсия случиться делать бог
 Радион? У меня такой же вопрос. Да. Подожди. Ты. Вот так и .Подожди, ты так изменился.;удивление;позитив;6;2;радион вопрос подождать .подождать измениться
 Кристина? Подожди, , Кристина, , Ханой. Что ты здесь делаешь, ты, вообще, восток не любила никогда. Ты чего здесь делаешь? Нет, подожди, а ты чего здесь делаешь? Ты чего? Подожди, а у тебя... Ты, ты за вьетнамца? Вышла? Серьёзно? Ты же, вообще, реально ненавидела восток, как ты здесь оказалась? Обалдеть! ;удивление;позитив;6;2;кристина подождать кристина ханой делать вообще восток любить делать подождать делать подождать ... вьетнамец выйти серьёзно вообще реально ненавидеть восток оказаться обалдеть
Подожди. Ты? Подожди, но, я живу. Как? Ты то как тут? Ты, да, ты ты так изменился. Ты похудел. Подожди. Да хотела. Ну да, ты. Ты тут живешь? Ты постоянно …;удивление;позитив;6;2;подождать подождать жить измениться похудеть подождать хотеть жить постоянно …
Крис? Да, а ты что тут делаешь? В ханое, ты ты , как ты, ты ж... Ты живешь здесь? А, ну приехал отдыхать, а ты? А ты здесь живешь? А, ну Слушай, обалдеть да прикинь. На 20 килограмм. А ты как вообще? Ты же в Париж хотела ехать жить. Ой подожди, у тебя кольцо? Ты здесь что-ли? За вьетнамца? Дак подожди ты ж вообще коротышек терпеть не могла. Нет.;удивление;позитив;6;2;крис делать ханой ... жить приехать отдыхать жить слушать обалдеть прикинуть 20 килограмм вообще париж хотеть ехать жить ой подождать кольцо что-ли вьетнамец дак подождать вообще коротышка терпеть мочь
Подожди ты? Родион!? ты что перекрасился !? Я живу, подожди ты модель.... Ты похудел !? Ну... Да... Подожди, ты сюда переехал и работаешь моделью? Ты ты. Какая-то фантастика! .;удивление;позитив;6;2;подождать родион перекраситься жить подождать модель .... похудеть ... ... подождать сюда переехать работать модель какой-то фантастика
 Крис? Ханой, чего ты здесь делаешь? Ну да, я моделью работаю. А ты что здесь делаешь? Подожди, ты беременна? А, подожди, какой у тебя.. У тебя чего, восьмой месяц уже? Подожди, здесь, от вьетнамца? Ничего себе! Ого. Да. А ты же в Европе хотела жить. Как ты здесь оказалась? ;удивление;позитив;6;2;крис ханой делать модель работать делать подождать беременный подождать .. восьмой месяц подождать вьетнамец ого европа хотеть жить оказаться
 Ну всё, приехали. У Вас воды нет? Воды. Пожалуйста, мне плохо. У меня сейчас Я просто Я очень боюсь замкнутого пространства.Нет. Воды, воды! Или мне сейчас плохо будет! Пожалуйста, воды! Воды! Я просто. У меня Астма. Астма, понимаете? Да! ;страх;негатив;5;0;всё приехать вода вода пожалуйста плохо просто очень бояться замкнутый пространства.нуть вода вода плохо пожалуйста вода вода просто астма астма понимать
Кристин? Воды нет, а что с Вами? А может быть Вам таблетку какую-то? Что? Тихо, успокойтесь. Дышите ровно, пожалуйста. Кристин, дышите ровно. Выдыхайте. Носом вдыхайте, ртом выдыхайте! ;страх;негатив;5;0;кристин вода вы таблетка какой-то тихо успокоиться дышать ровно пожалуйста кристин дышать ровно выдыхать нос вдыхать рот выдыхать
Ну Все, все. У вас . вода есть? Я, я, я просто очень боюсь замкнутого пространства. . Сейчас. . Нет. Ну что-нибудь у вас есть, пожалуйста или вызовите. Я не знаю! Сделаете что-нибудь! . Да , понимаете вы? Мне… . Да все..;страх;негатив;5;0;вода просто очень бояться замкнутый пространство что-нибудь пожалуйста вызвать знать сделать что-нибудь понимать мне… ..
Нет. А что с вами? . Сейчас подождите. . Ровно дышите. . А что нужно? . Сейчас подождите. . У меня зарядка села, дайте свой телефон. . Телефон свой дайте. Успокойтесь! Тихо, спокойно, спокойно! Не надо нервничать. Дышите ровно. Дышите. Смотрите на меня. Успокойтесь! Успокойтесь! Дайте свой телефон, телефон;страх;негатив;5;0;вы подождать ровно дышать нужно подождать зарядка село дать свой телефон телефон свой дать успокоиться тихо спокойно спокойно нервничать дышать ровно дышать смотреть успокоиться успокоиться дать свой телефон телефон
Все..Господи, зачем я села в этот лифт? Ну я же знаю, что нельзя. . Мне сейчас просто плохо будет, понимете? У меня . Я, я очень боюсь замкнутого пространства! . Сейчас. . Мне кажется сейчас нас задавит! . Да! . Нет! Подождите, нет. Я . Я сейчас . Сейчас мне плохо будет, понимаете? Я сейчас упаду в обморок. подождите. . Мне кажется. Мне кажется, что стены давят. Понимаете? Я очень боюсь замкнутого пространства…;страх;негатив;5;0;.. господь село лифт знать просто плохо понимета очень бояться замкнутый пространство казаться задавить подождать плохо понимать упад обморок подождать казаться казаться стена давить понимать очень бояться замкнутый пространства…
Что, что с вами? Может вам нужно что-то? Подождите, что вам нужно скажите щас. . Смотрите на меня, успокойтесь девушка, девушка девушка успокойтесь смотрите на меня, дышите ровно, ровно дышите, смотрите на меня, откройте глаза. Не, не поникуйте, что вам нужно скажите. . Щас я позвоню. . что сделать то, .;страх;негатив;5;0;вы нужно что-то подождать нужно сказать сейчас смотреть успокоиться девушка девушка девушка успокоиться смотреть дышать ровно ровно дышать смотреть открыть глаз пониковать нужно сказать сейчас позвонить сделать
А вы слышали Марья Сергеевна она уволилась из раздела маркетинга? Я, она уехала у нее там с мамой беда какая-то и она, то есть вообще с концами, в общем. Просто это единственный... Ну да и как человек знаете она всегда поддержит и с ней поговорить по душам как-то можно было, а щас. Ну да. Да и работник хороший какой был. Стаж такой. С мамой у нее.;грусть;негатив;1;0;слышать марья сергеевич уволиться раздел маркетинг уехать мама беда какой-то вообще конец общий просто это единственный ... человек знать поддержать поговорить душа как-то сейчас работник хороший стаж мама
Да. Жалко, конечно. Коллега хорошая была. Да. 10 лет вместе проработали. А что у нее случилось?;грусть;негатив;1;0;жалко коллега хороший 10 год вместе проработать случиться
Слышали да? Марья Сергеевна уволилась. Она уехала и, вроде как вообще с концами у неё там с мамой какая-то беда и сидеть некому, ну с мамой всмысле сидеть некому. Ну да. Столько в компанию вложил конечно Да знаете, когда коллектив вообще разваливается это , она конечно да. Но а вы с ней давно были знакомы? лет пять;грусть;негатив;1;0;слышать марья сергеевич уволиться уехать вроде вообще конец она мама какой-то беда сидеть некого мама всмысл сидеть некого столько компания вложить знать коллектив вообще разваливаться это давно знакомый год пять
Да. Да. Жалко, конечно. Человек хороший да и по работе всегда помогала. Да. . Лет 5. .;грусть;негатив;1;0;жалко человек хороший работа помогать год 5.
Вы слышали, да, Марья Сергеевна она уволилась из отдела совсем. . Уехала куда-то. У нее там с мамой проблемы какие-то. Конечно, как без нее сейчас. Ну. Да, все-таки организаторские способности. . У нее были лучше всех. А человека еще. Да. . Помните, в прошлый корпоратив она…;грусть;негатив;1;0;слышать марья сергеевич уволиться отдел уехать куда-то мама проблема какой-то всё-таки организаторский способность человек помнить прошлый корпоратив она…
Да , слышал. Ну у нас отдел точно без неё больше не справиться . Всё на ней держалось. Заботливая была очень. да.;грусть;негатив;1;0;слышать отдел точно она справиться всё держаться заботливый очень
Вот пожалуйста, вот что это такое? Я просто не понимаю этому же человеку ему же еще хватило прилюдно это, так сказать, сказать, что вот они уволены за невыполнение. А вы вообще че вы сидели как мямля , вас когда спраши, вас вообще когда кто нибудь спрашивает вы когда нибудь можете за себя постоять просто напросто, я, я сидела, между прочим я заступалась за себя и за вас.;гнев;негатив;0;0;пожалуйста это такой просто понимать этот человек хватить прилюдно это сказать сказать уволить невыполнение вообще че сидеть мямлить спраша вообще спрашивать мочь постоять просто напросто сидеть прочить заступаться
Чего вы на меня кричите? Я не понимаю? Что я сделал? А чего вы сидели? Вы что самая умная что ли? Давайте тоже сделайте что-нибудь тогда. Конечно! Блин, сейчас вмажу чем-нибудь.;гнев;негатив;0;0;кричать понимать сделать сидеть самый умный давать сделать что-нибудь блин вмазать что-нибудь
Ну вот и что вы стоите, Родион Владимирович? Вам нравится вся эта ситуация, которая произошла? А да? А вы нет. А почему вы? Вы даже за себя постоять не можете. Вы не то, что за себя, вы за кого-то другого, я вообще молчу! Я не самая умная, но дорогой мой, когда вас унижают прилюдно вы можете заступиться! Я уж не говорю заступиться за девушку, вы даже за себя не можете постоять, понимаете? Я столько проработала на эту контору! И по итогу я должна потом выслушивать? Это мои проблемы? Да, конечно, Родион Владимирович, это мои проблемы, но только вы мямля! Понимаете? Которая не может постоять за себя!;гнев;негатив;0;0;стоить родион владимирович нравиться весь этот ситуация который произойти почему постоять мочь кто-то другой вообще молчать самый умный дорога унижать прилюдно мочь заступиться говорить заступиться девушка мочь постоять понимать столько проработать контора итог должный выслушивать это мой проблема родион владимирович это мой проблема мямлить понимать который постоять
Кристина Игоревна, давайте не будем сейчас . А чего вы сидели? Вы что самая умная что ли? Так, а там вы что молчали? Что вы наезжаете на меня? Это ваши проблемы, я то тут причем? Да! Я тут причем, скажите? Я тебе реально вмажу сейчас!;гнев;негатив;0;0;кристина игоревич давать быть сидеть самый умный молчать наезжать это ваш проблема причём причём сказать ты реально вмазать
Нет, вы представляете, я сегодня захожу в офис значит, сажусь как ни в чем не бывало на свое рабочее место и тут чувствую чем-то воняет. Знаете, когда вот то ли канализацией, то ли лошадь какая-то прошла. Я поднимаю голову вверх, а у меня на соседнем столе, где нет еще коллеги капает, вот . Я не знаю в общем . Ну да, можно и так сказать. В общем там прорвало трубу и там и там воняет на весь офис… . Вы понимаете самое главное это почистим, но вот это смердящий запах стоит на весь офис . Я просто не проветривается это . Он не уходит никуда.;отвращение;негатив;3;0;представлять сегодня заходить офис значит садиться бывало свой рабочий место чувствовать что-то вонять знать канализация лошадь какой-то пройти поднимать голова вверх соседний стол коллега капать знать общий сказать общий прорвать труба вонять весь офис… понимать самый главное это почистить это смердеть запах стоить весь офис просто проветриваться это уходить никуда
Дерьмо что ли? У нас тоже в офисе этажом выше это от нас что ли? . Да? ;отвращение;негатив;3;0;дерьмо офис этаж выше это
Фу, господи. Вы чувствуете какой-то пропастиной воняет это всё? Я просто не могу понять это что? Это не только извините меня, моча это какая-то... навоз какой-то.  фу, госоподи. Слушайте, хорошо что ещё мухи не полетели, и вообще фу... еще лечинки не развились тут. Я просто не понимаю это что никто не убирает что ли?  фу. Ну пожалуйста не каркайте ладно только вот, и так воняет.;отвращение;негатив;3;0;фу господь чувствовать какой-то пропастина вонять это всё просто мочь понять это это извинить моча это какой-то ... навоз какой-то фу госоподить слушайте ещё муха полететь вообще фу ... лечинк развиться просто понимать это никто убирать фу пожалуйста каркать ладный вонять
 Неудивительно. . Да, санина это, вы что не видите? . Нам еще долго ехать тут? . Эти разводы мерзкие. . Еще только застрять нам не хватало тут .;отвращение;негатив;3;0;неудивительный санин это видеть мы долго ехать развод мерзкий застрять мы хватать
