Transcription;Emotion;Sentiment;Emotion digits;Sentiment digits;Transcription tokens
Давай ты успокоишься для начала. Ты можешь не вестись на эту ерунду - это специально провоцирует людей. Ты можешь успокоиться просто! А как люди с которыми мы договорились!? Подожди, подожди, стоп, стоп мы заказли билеты месяц назад, подожди пожалуйста! Ты можешь себя взять в руки!? Ты можешь взять себя в руки?! ;гнев;негатив;0;0;давать успокоиться начало мочь вестись ерунда это специально провоцировать человек мочь успокоиться просто человек который договориться подождать подождать стоп стоп заказлить билет месяц назад подождать пожалуйста мочь взять рука мочь взять рука
Подожди, подожди, успокойся пожалуйста. Подожди, подожди, успокойся. И что, что умерло 400 человек? Мы эту поездку запланировали ещё месяц назад, ты понимаешь? Ты понимаешь, как мне достались эти билеты!? Да какой папа?.. Да стоп... Да подожди. Мы же забронировали уже отель, ты понимаешь, что это уже невозможно вернуть билеты? Стоп, да мы ждали эту поездку год практически! Да что ты обращаешь внимание на этих людей! Да хватит обращать внимание на новости! Да что ты за ерунду несёшь!? Ты мужик или как вообще!? Да возьми ты себя в руки! Да что ты чувству!.. Да успокойся, выпей воды!;гнев;негатив;0;0;подождать подождать успокоиться пожалуйста подождать подождать успокоиться умереть 400 человек поездка запланировать ещё месяц назад понимать понимать достаться билет папа .. стоп ... подождать забронировать отель понимать это невозможно вернуть билет стоп ждать поездка год практически обращать внимание этот человек хватить обращать внимание новость ерунда нести мужик вообще взять рука чувство .. успокоиться выпить вода
Кристин, привет. Ты слышала там самолёт упал в Зеландии? Нам завтра улетать, ты понимаешь это вообще? Я...Я...Я боюсь, я не знаю, что делать, я не могу. Давай отменим поезку, давай сдадим билеты. Я... Ну... Слушай, как я могу успокоиться, подожди. Слушай, какая ерунда, как какая провокация? Ты с ума сошла? Просто самолёт взял и разбился. Ты понимаешь 400 человек, там никто не выжил! Ты понимаешь!? Я не смогу!.. Давай отменим поездку, я не могу! Давай по другому как-нибудь! Давай!.. Давай на корабле. Слушай, я не могу туда. Всё, я не полечу, я сказал, ты понимаешь!? Ты понимаешь, что мне страшно!? ;страх;негатив;5;0;кристин привет слышать самолёт упасть зеландия мы завтра улетать понимать это вообще ... ... бояться знать делать мочь давать отменить поезка давать сдать билет ... ... слушать мочь успокоиться подождать слушать ерунда провокация ум сойти просто самолёт взять разбиться понимать 400 человек никто выжить понимать смочь .. давать отменить поездка мочь давать другой как-нибудь давать .. давать корабль слушать мочь туда всё полечить сказать понимать понимать страшно
Кристин, привет .. слушай .. Я боюсь лететь, там разбился самолёт, я сейчас смотрел. А.. я... Всё, давай отменим, я не могу, слушай. Там 400 человек умерло, ты понимаешь, 400 человек? Слушай, я не могу... Слушай я. Ты понимаешь, у меня папа сейчас болеет? Кто с ним будет сидеть, понимаешь? Мне страшно, я..я не могу лететь. Слушай, давай отменим, давай перенесём я..я... Я не могу лететь. Ты понимаешь я не могу просто всё. Я не могу выйти из дома, мне страшно. Мне страшно, я разобьюсь. Я чувствую, что я разобьюсь на этом самолёте, понимаешь? Я чувствую это, это не просто так. Это - знак. Я, я не могу, я не полечу никуда. ;страх;негатив;5;0;кристин привет .. слушать .. бояться лететь разбиться самолёт смотреть .. ... всё давать отменить мочь слушать 400 человек умереть понимать 400 человек слушать мочь ... слушать я. понимать папа болеть сидеть понимать страшно .. мочь лететь слушать давать отменить давать перенести .. ... мочь лететь понимать мочь просто всё мочь выйти дом страшно страшно разбиться чувствовать разбиться самолёт понимать чувствовать это это просто это знак мочь полечить никуда
Почему? Подожди... Ну подожди, ну как же, но мы же так давно планировали это? Но может быть кто-то из родственников может?;грусть;негатив;1;0;почему подождать ... подождать давно планировать это кто-то родственник
Крис я не смогу поехать в Новую Зеландию. У меня заболел папа и мне нужно с ним будет сидеть. Ну ты понимаешь, он начинает конючить. Я предлагал ему, что бы сиделка была, он отказывается от всего. Ну вообщем, я не знаю, что делать. Я понимаю, что планировали. Ну а чего тут сделаешь?;грусть;негатив;1;0;крис смочь поехать новый зеландия заболеть папа нужно сидеть понимать начинать конючить предлагать сиделка отказываться вообщий знать делать понимать планировать сделать
Ну... Ну я забыла. Ну-ну. Ну у меня экзамены были?.. Ну ты понимаешь, что? Ну ты мог мне напомнить? Ну я забыла, ну.;грусть;негатив;1;0;... забыть ну-ну экзамен .. понимать мочь напомнить забыть
Я тебя просто попросил купить билеты, понимаешь, на самолёт!? Я всё сделал: забронировал гостиницу, я договорился со всеми организациями. Просто купить билеты - это что сложно!? Что значит забыла!? Какой экзамен, ты вообще сумашедшая или что!? Какой экзамен к чёрту!? Мы сколько готовились к этой поездке! Просто купить билеты! Я напомнить тебе должен!? Всё организовать и напомнить!? Может тебе ещё...;гнев;негатив;0;0;просто попросить купить билет понимать самолёт всё сделать забронировать гостиница договориться весь организация просто купить билет это сложно значит забыть экзамен вообще сумаидти экзамен чёрт сколько готовиться поездка просто купить билет напомнить ты должный всё организовать напомнить ты ещё ...
Ну прости пожалуйста, но я забыла. Ну у меня столько дел накопилось. Ну ты. Ну ты можешь не кричать на меня? Ну.. ;грусть;негатив;1;0;простить пожалуйста забыть столько дело накопиться мочь кричать ..
Слушай, я просто попросил тебя купить билеты на самолет. Это что сложно? А, прости, да, и все. Конечно, ну столько дел, ну естественно, конечно. Че просто взять билеты, понимаешь? Билеты взять. Я все сделал. А, извините, пожалуйста, нельзя кричать на тебя, да? А что я тебя похвалить сейчас должен, да? Ну, и все да?;гнев;негатив;0;0;слушать просто попросить купить билет самолёт это сложно простить столько дело естественно че просто взять билет понимать билет взять сделать извинить пожалуйста кричать похвалить должный
Ну ты можешь не кричать на меня хотя бы? Ну я забыла, у меня было много дел. Ну просто на меня навалилось, да. Ну извини меня...;грусть;негатив;1;0;мочь кричать хотя забыть дело просто навалиться извинить ...
Кристина, почему нельзя было купить билеты!? Я сделал всё! Я организовал, я договорился со всеми компаниями. Да могу конечно, конечно. Ах ты забыла, ну да, нормальная история да вот. Мы 5 лет с тобой дружим, и 5 лет ты забываешь. Ах навалилось, да . Погода не та, да!? Сатурн, тригон Сатурна там в Нептуне, да? Ну как ты вообще, чем ты соображешь? Как, как это возможно?;гнев;негатив;0;0;кристина почему купить билет сделать всё организовать договориться весь компания мочь ах забыть нормальный история 5 год ты дружить 5 год забывать ах навалиться погода тот сатурн тригон сатурн нептун вообще сообразать это возможно
Это фу ну. Ну фу . Ну тебе самому непротивно?;отвращение;негатив;3;0;это фу фу ты сам непротивный
Мы в тот раз, когда ездили в Китай, там Женька заказал, знаешь этих . Личинки, живые такие. И у них знаешь морды такие красные были. Они вот такие склизкие были. И он так их брал, понимаешь, мне сразу блевать тянуло, понимаешь? И вот там жуки, они вот такие. У них мерзкие лапки такие, знаешь? И они фу . А там. А там знаешь ещё этот  . Там какя-то слизь была такая, как сопли, знаешь? Вот так вот поднимаешь. И он это ел всё. А ему нравилось.;отвращение;негатив;3;0;ездить китай женька заказать знать этот личинка живой такой знать морда такой красный такой склизкий брать понимать сразу блевать тянуть понимать жук такой мерзкий лапка такой знать фу знать ещё какть-то слизь такой сопля знать поднимать это есть всё нравиться
Фу! Да фу, ну он же склизский! ;отвращение;негатив;3;0;фу фу склизский
Слушай, я там смотрел видео чо они там хавают. Там эти, ... Личинки какие-то, знаешь? И у них мордочка такая красная. И у них лапки какие-то мерзкие такие. Слушай, а когда он его съедал, это, потом жука у него вот так вот вытекал гной какой-то из него. Слизь там какая-то. И ... эти ... Как сопли слушай, ну такие. Это можно просто ;отвращение;негатив;3;0;слушать смотреть видео что хавать ... личинка какой-то знать мордочка такой красный лапка какой-то мерзкий такой слушать съедать это жук вытекать гной какой-то слизь какой-то ... ... сопля слушать такой это просто
Родион, у меня для тебя хорошая новость! Мы едем в Новую Зеландию! Ну вот так едем! Я мне выдали премию и там был горящий тур и я решила купить. Ну как, как какая? Ну у нас годовая премия была. Да почему не может? Ну у нас за целый год выбрали...;радость;позитив;4;2;родион хороший новость ехать новый зеландия ехать выдать премия гореть тур решить купить годовой премия почему целый год выбрать ...
 Подожди как, как едем? Какая премия? Откуда? Как? Ну... Подожди, какая годовая да это быть не может . Ну как. Какая премия? Вам 20 лет премию не выдавали.;радость;позитив;4;2;подождать ехать премия откуда ... подождать годовой это премия 20 год премия выдавать
Мы едем в новую Зеландию я купила нам билеты! Ну вот так купила, нам выдали премию на работе и там были горячие путевки. Ну вот такая премия! Ну вот начальник у нас вот такой добрый стал под новый год, решил выдать всем премии. Ну как не может быть! Ну и что это же круто, смотри горячие путевки прям для нас, понимаешь. Да может, как...;радость;позитив;4;2;ехать новый зеландия купить мы билет купить мы выдать премия работа горячий путёвка такой премия начальник добрый стать новый год решить выдать весь премия это круто смотреть горячий путёвка прям понимать ...
 Как, подожди, как купила? Подожди какая премия? Вам никогда премию не давали. Этого быть не может! Какая Новая Зеландия, мы десять лет туда не можем поехать . Не может быть, ты чего;радость;позитив;4;2;подождать купить подождать премия премия давать новый зеландия десять год туда мочь поехать
Подождите. Что произошло? Стоп, а каком мы этаже? Подождите, может быть. Стоп. Сейчас. Подождите. Надо что-то. Надо вызвать диспетчера.;страх;негатив;5;0;подождать произойти стоп какой этаж подождать стоп подождать что-то вызвать диспетчер
А, застряли что ли? А. Так, , я ж, , таблетки щас не, я ж таблетки не взял, боже, они там в кабинете же остались . Че делать то? Я щас, я щас задыхаться же начну. . У меня, щас. .;страх;негатив;5;0;застрять а. таблетка сейчас таблетка взять бог кабинет остаться че делать сейчас сейчас задыхаться начать сейчас
Ты понимаешь, он меня уволил, ну как так можно, а? Да, да я столько вложила в эту компанию, я ежегодно ездила на эти фестивали, тратила свое время, я, я практически не была с семьей, понимаешь, я с десяти утра, до шести, до шести рабочий день, но я-то сидела до девяти вечера в офисе. Сколько я потратила на это времени? Сколько я вложила своих сил? И вот так вот, пожалуйста, нате. Четыре года. Я шесть лет проработала в этой компании.;гнев;негатив;0;0;понимать уволить столько вложить компания ежегодно ездить фестиваль тратить свой время практически семья понимать десять утро шесть шесть рабочий день я-то сидеть девять вечер офис сколько потратить это время сколько вложить свой сила пожалуйста нате четыре год шесть год проработать компания
Он нас уволил. Я вообще поражаюсь, конечно. Просто. Да, он просто взял и уволил! Урод, понимаешь? Урод! Четыре года? Четыре года, прикинь. Ха, шесть лет.;гнев;негатив;0;0;уволить вообще поражаться просто просто взять уволить урод понимать урод четыре год четыре год прикинуть ха шесть год
Ну ты понимаешь, что случилось ? Как так можно было потратить столько лет на эту контору, чтобы она тебя вот так потом вышвырнула? Да? И тебе нормально с этим живется я смотрю? Я столько сил вложила в эту компанию, я столько встреч провела, столько семинаров сделала. Ты понимаешь? Да он не урод. Он просто, я не знаю. Четыре года? Я шесть лет проработала в этой компании. И что? И какое, это спасибо значит?;гнев;негатив;0;0;понимать случиться потратить столько год контора вышвырнуть ты нормально это житься смотреть столько сила вложить компания столько встреча провести столько семинар сделать понимать урод просто знать четыре год шесть год проработать компания какой это спасибо значит
 Да, вот так просто взяла и вышвырнула. Нет, не нормально мне живётся с этим. Просто урод. Урод! Просто урод! Четыре года, понимаешь? Четыре. ;гнев;негатив;0;0;просто взять вышвырнуть нормально житься это просто урод урод просто урод четыре год понимать четыре
Фу. Господи, какой ужас, а. Ну вот. .;отвращение;негатив;3;0;фу господь ужас а.
Что за вонь? Я. . Сколько ехать-то еще с этим?;отвращение;негатив;3;0;вонь я. сколько ехать-то это
Да. Что за вонь-то? Здесь чё осёл что ли был, я не понимаю? Что за? Ой, центр Москвы. Сколько ехать-то еще вообще? Фу ты. Вот срань, а. У вас. У вас салфетка.;отвращение;негатив;3;0;вонь-то что осёл понимать ой центр москва сколько ехать-то вообще фу срань а. салфетка
 Угу. Еще двадцать этажей. Ну пере...;отвращение;негатив;3;0;угу двадцать этаж перо ...
Вы тоже чувствуете вонь? Да, фу. Че здесь кабан что ли был. Что за мерзость. Девушка, сколько нам там ехать еще? Тьфу, ты. Можно я. ;отвращение;негатив;3;0;чувствовать вонь фу че кабан мерзость девушка сколько мы ехать тьфу
Представляешь, меня назначили начальником нового отдела по работе с корпоративными клиентами. Ну да, по работе с зарубежными клиентами. Ну это же круто! Да. Ну вот буквально пару дней назад. Ну я не знаю. Смотри, мы продумали стратегию, чтобы. Там .;радость;позитив;4;2;представлять назначить начальник новый отдел работа корпоративный клиент работа зарубежный клиент это круто буквально пара день назад знать смотреть продумать стратегия
Как? Что за? Такой отдел есть? В смысле? Подожди, то есть у нас открыли этот отдел? Подожди, когда открыли? Как. Как, подожди, почему, почему я не знал об этом? Что. Нет, подожди. В смысле, а сколько там сотрудников?;удивление;позитив;6;2;отдел смысл подождать открыть отдел подождать открыть подождать почему почему знать подождать смысл сколько сотрудник
