Transcription;Emotion;Sentiment;Emotion digits;Sentiment digits;Transcription tokens
прятки. для того чтобы сыграть в прятки, необходимо как минимум два человека. один из которых является водой. , соответственно правило для воды. Вода отходит в сторонку , закрывает глазки и начинает монотонно отсчитывать нужное количество цифр, желательно не меньше двадцати чтобы народ успел спрятаться. остальные, ищут для себя самое укромное местечко, где по их мнению они не будут замечены. соответственно, после того как вода заканчивает счет-он отправляется на поиски тех ребят, которые спрятались и игра продолжается до тех пор, пока не будет обнаружен крайний спрятавшийся человек.;нейтраль;нейтраль;2;1;прятки сыграть прятки необходимо минимум человек который являться вода соответственно правило вода вода отходить сторонка закрывать глазок начинать монотонно отсчитывать нужный количество цифра желательно маленький двадцать народ успеть спрятаться остальной искать самый укромный местечко мнение быть заметить соответственно вода заканчивать счет-он отправляться поиск тот ребята который спрятаться игра продолжаться тот пора пока обнаружить крайний спрятаться человек
крокодил. для того чтобы сыграть в крокодил: нужна компания из пяти, шести и более человек. первый , встает лицом к другим и придумывает какой-нибудь предмет или человека или еще что-нибудь. он должен показать всеми способами, но при этом не говоря и не подсказывая другим описать этого человека или предмет. Другие же должны угадать. Кто первый угадает и произнесет вслух это слово, тот будет следующим игроком.;нейтраль;нейтраль;2;1;крокодил сыграть крокодил нужный компания пять шесть человек первый вставать лицо другой придумывать какой-нибудь предмет человек что-нибудь должный показать весь способ говорить подсказывать другой описать человек предмет другой должный угадать первый угадать произнести вслух это слово следующий игрок
Меня зовут Алина. Мне 20 лет. Я выросла, родилась и живу в Москве. Я проучилась одиннадцать лет в школе. после школы я, пришла во в ГИК на подготовительные курсы актерского мастерства. Я занималась мотоспортом и занималась академическим вокалом. Работают фотографом и расписываю фасады домов.;нейтраль;нейтраль;2;1;звать алина 20 год вырасти родиться жить москва проучиться одиннадцать год школа школа прийти гик подготовительный курс актёрский мастерство заниматься мотоспорт заниматься академический вокал работать фотограф расписывать фасад дом
Меня зовут Влад. Мне девятнадцать лет. Родился я восьмого сентября тысяча девятьсот девяносто седьмого года в городе Барнауле. Восемнадцать лет я прожил в этом городе, и уже полтора года живу в Москве. За это время я два раза побывал за границей: один раз в Германии ... два раза в Германии и один раз в Париже. Очень много ездил по России, занимался в театральных студиях, немного занимался вокалом и семь лет занимался хореографией. Сейчас я хожу на подготовительные курсы во ВГИК.;нейтраль;нейтраль;2;1;звать влад девятнадцать год родиться восьмой сентябрь тысяча девятьсот девяносто седьмой год город барнаул восемнадцать год прожить город полтора год жить москва это время раз побывать граница германия ... раз германия париж очень ездить россия заниматься театральный студия немного заниматься вокал семь год заниматься хореография ходить подготовительный курс вгик
 Слушай, Саш, ну вот ты опять начинаешь. Ну зачем ты опять начинаешь? Ну сколько раз мы пытаемся куда-то поехать, и в итоге ничего не получается. Ты каждый раз отказываешься. Уже и так тебя подменяли один раз, другой раз, ну что это происходит, Саш? В какую судьбу ты веришь? Ну чт... Саш, ну я же еду туда! Я еду!;гнев;негатив;0;0;слушать саша начинать начинать сколько пытаться куда-то поехать итог получаться каждый отказываться подменять это происходить саша какой судьба верить чт ... саша еда туда еда
Люб, привет, я не поеду в поездку в эту запланированную. Прости, но я просто не могу. Я сейчас увидел сюжет, этот самолёт летел тоже туда же, куда мы запланировали, в Новую Зеландию. Я, я просто увидел эти оторванные шасси, потом кучи чемоданов, которые лежали там. Уже их собрали спасатели. Люба, ну я верю в судьбу, ну что, ну что мне теперь делать? Да, я боюсь, я, я, я реально боюсь этого. Я просто увидел, просто. Ты послушай меня хотя бы, послушай то, что! Ну;страх;негатив;5;0;люба привет поехать поездка запланировать простить просто мочь увидеть сюжет самолёт лететь туда запланировать новый зеландия просто увидеть оторвать шасси куча чемодан который лежать собрать спасатель люба верить судьба делать бояться реально бояться просто увидеть просто послушать хотя послушать
Что? Саш, вот ты опять начинаешь! Вот зачем ты это делаешь, Саш? Саш, ну я же лечу, и всё нормально, ну! Саш! ;гнев;негатив;0;0;саша начинать это делать саша саша лететь всё нормально саша
Что, Саша, ты, ты о чём сейчас говоришь? Да билеты уже куплены, ну Саша, ну ты что, что? То есть ты хочешь, чтобы я сама полетела, да? Нормально! Нет, Саша! Мы договаривались вместе лететь, вдвоём!;гнев;негатив;0;0;саша что говорить билет купить саша хотеть сам полететь нормально саша договариваться вместе лететь вдвоём
Люба, я тебе прям сразу скажу, прямо же. Я не полечу в эту поездку в Новую Зеландию. Я не могу. Я просто сегодня видел сюжет по телевизору. И там разбился точно такой же самолёт, вот на который мы взяли билеты. И это может произойти с нами. И я в это свято верю, поэтому прости, пожалуйста, но я не полечу. Я ничё не начинаю я просто боюсь, я реально боюсь. Это паника, страх, называй меня как хочешь, я не знаю, тряпкой, не мужиком, но я... Что я делаю? Я, я увидел сюжет, я не могу, Люба. Если произойдёт экстренная какая-то посадка на воду, меня это тоже никак вообще, ну, не удовлетворяет, и я плавать не могу. Ты это прекрасно знаешь, и я... Ты летишь, ты мастер спорта по плаванию, мне что тогда делать, ты меня что, спасёшь? Ты в этом плане просто запаникуешь, и тоже так же уплывёшь от меня, и меня съедят акулы. ;страх;негатив;5;0;люба ты прям сразу сказать прямо полечить поездка новый зеландия мочь просто сегодня видеть сюжет телевизор разбиться точно самолёт который взять билет это произойти мы это святой верить поэтому простить пожалуйста полечить ничего начинать просто бояться реально бояться это паника страх называть хотеть знать тряпка мужик ... делать увидеть сюжет мочь люба произойти экстренный какой-то посадка вода это никак вообще удовлетворять плавать мочь это прекрасно знать ... лететь мастер спорт плавание делать спасти план просто запаниковать уплыть съесть акула
Люба, я тебе хотел сказать. Я сегодня увидел сюжет по телевизору, то, что разбился самолёт, вот точно такой же, похожий, прямо вот с такими же наклейками этой же авиакомпании, на которой мы полетим в Новую Зеландию. Я не полечу, Люба. Вот что хочешь говори, я реально не могу. Я говорю о том, что разбился самолёт, Люба, и я боюсь, я реально боюсь. Это у меня паника, страх. Я просто не могу, Люба. Ну и что, билеты куплены! Люба, а ты видела этот сюжет? Просто там реально, там была куча багажа у людей, и там был чемодан точно такой же, как у меня. И я в это верю. Да, я хочу, чтоб ты полетела одна. Хочешь, возьми Христю, возьми Лизу, я не знаю, кого. Возьми Машку. Давай обменяем билеты, я готов заплатить за это, но только я не полечу. Ну мы договаривались, Люба, мы о многом договаривались, но я не могу, я увидел;страх;негатив;5;0;люба ты хотеть сказать сегодня увидеть сюжет телевизор разбиться самолёт точно похожий прямо такой наклейка авиакомпания который полететь новый зеландия полечить люба хотеть говорить реально мочь говорить разбиться самолёт люба бояться реально бояться это паника страх просто мочь люба билет купить люба видеть сюжет просто реально куча багаж человек чемодан точно это верить хотеть полететь один хотеть взять христя взять лиза знать кто взять машка давать обменять билет готовый заплатить это полечить договариваться люба многое договариваться мочь увидеть
Саша, ты серьёзно? Блин, как же круто! Саша! Вообще просто круто, это же просто поездка моей мечты, Саш! Да ну, ладно! Серьёзно? Как, как круто! Кто? Блин, как же круто! Как же классно, господи, Саша! Это же правда круто, блин!;радость;позитив;4;2;саша серьёзно блин круто саша вообще просто круто это просто поездка мой мечта саша ладный серьёзно круто блин круто классно господь саша это правда круто блин
Люба, я достал билеты, мы полетим на Алтай. Поедем в Горноалтайск и я покажу тебе ту самую пещеру, которую ты хотела увидеть. Да, я серьёзно. Это действительно так. Мы пойдём туда и посмотрим Алтайскую принцессу в музее в Горноалтайске. Полетим в Барнаул. Мы прилетаем в Барнаул, представляешь? Вот. И там будет всё, что ты захочешь, все экскурсии. Мы поедем в лес, поедем в заповедник. Это замечательно. Я рад, что доставил тебе удовольствие. Ты довольна? Вот, это замечательно. Я ещё что-нибудь придумаю по пути, когда мы там будем. Люба, я всё таки достал билеты, мы едем всем нашим курсом в Тавриду, представляешь? Да! Да! Замечательно. Да! И, а знаешь ещё кто с нами поедет? С нами поедет Стас и Серёга Полюхин! Вот. Я достал. Там будет большая экскурсия. Мы поедем по этим знаменитым местам, где был Женя Куприянов. Мы будем купаться в Чёрном море. Это шикарно! Едут все, Люба. Поедут все.;радость;позитив;4;2;люба достать билет полететь алтай поехать горноалтайск показать ты тот самый пещера который хотеть увидеть серьёзно это действительно пойти туда посмотреть алтайский принцесса музей горноалтайск полететь барнаул прилетать барнаул представлять всё захотеть экскурсия поехать лес поехать заповедник это замечательный рад доставить ты удовольствие довольный это замечательный ещё что-нибудь придумать путь быть люба всё таки достать билет ехать весь наш курс таврид представлять замечательный знать ещё мы поехать мы поехать стас серёга полюхина достать больший экскурсия поехать это знаменитый место женя куприянов быть купаться чёрный море это шикарно ехать люба поехать
Саш, я понимаю, но вообще, да, никак? Да, я понимаю. ;грусть;негатив;1;0;саша понимать вообще никак понимать
Саш, вообще никак? Да, очень жалко, Саш. Да ладно, я, я всё понимаю. Я понимаю. Да я понимаю, Саш, конечно, я всё понимаю. ;грусть;негатив;1;0;саша вообще никак очень жалко саша ладный всё понимать понимать понимать саша всё понимать
Любаш, всё-таки нет. Всё-таки я не могу поехать. Мне очень жаль. Реально, очень жаль. Ну просто дедушке стало хуже. Врач только что позвонил, сказал, чтобы я оставался. Я никак не могу поехать. Я уже перепробовал все варианты, и я никак, реально, не могу. Я должен остаться. Прости, пожалуйста. Я подвожу всю группу. Я сам очень хотел, правда. Ну. Ну вообще никак, Любаш. Вот, вот никак. Я, я спросил вариант с сиделкой, что-то как-то договориться с медсёстрами. Ну никак. Они говорят, что должен быть вы. То, что он на меня реагирует хоть как-то, а на них никак. Отказывается от всего. Вот. Ну, вот. Пойми меня, пожалуйста. Правда. Мне очень хотелось быть там, потому что ... ;грусть;негатив;1;0;любаша всё-таки всё-таки мочь поехать очень жаль реально очень жаль просто дедушка стать плохой врач позвонить сказать оставаться никак мочь поехать перепробовать вариант никак реально мочь должный остаться простить пожалуйста подводить группа очень хотеть правда вообще никак любаша никак спросить вариант сиделка что-то как-то договориться медсестра никак говорить должный реагировать как-то никак отказываться понять пожалуйста правда очень хотеться ...
Любаш, ты знаешь? Всё-таки нет. Всё-таки вот мне позвонил врач только что. Сказал, что дедушке стало хуже. Я. Я никак, реально, не могу поехать. Я понимаю, что я подвожу. Я сам очень хотел. Я понимаю, куда мы едем. Мы едем на родину Александра Яковлевича. Он обещал нам показать свой дом, где он родился. Все места, где он был. Но я, я, правда. Вообще никак, Любаш. Я договаривался с сиделкой, я договаривался с медсёстрами. Они говорят, ну никак нельзя. Я не понимаю. Ну, мне очень жаль. Может быть как-то в другой раз. Правда, Люба, очень жалко мне. Я ну никак не могу поехать. Очень сожалею. Ну прости, пожалуйста. Не обижайся только на меня. Я подвожу всю группу. Я понимаю. Мне действительно очень, ты сама знаешь, как для меня это важно. Я сам хотел давно там побывать. Я сам покупал билеты, я сам всё это делал, всю эту поездку, и сейчас я отказываюсь. Ну ты сама понимаешь, что это мой дедушка, и я должен ему помочь, тем более в такой ситуации. Никак не могу поехать. Прости, пожалуйста. ;грусть;негатив;1;0;любаша знать всё-таки всё-таки позвонить врач сказать дедушка стать плохой я. никак реально мочь поехать понимать подводить очень хотеть понимать ехать ехать родина александр яковлевич обещать мы показать свой дом родиться место правда вообще никак любаша договариваться сиделка договариваться медсестра говорить никак понимать очень жаль как-то правда люба очень жалко никак мочь поехать очень сожалеть простить пожалуйста обижаться подводить группа понимать действительно очень сам знать это важно хотеть давно побывать покупать билет всё это делать поездка отказываться сам понимать это дедушка должный помочь ситуация никак мочь поехать простить пожалуйста
Саш, ну вообще никак что-ли, или как? Саш, ну ведь мы, мы же как ... Ведь ты же мне обещал с папой познакомиться с моим. Ладно. Да я не обижаюсь, Саш. Я понимаю. ;грусть;негатив;1;0;саша вообще никак что-ли саша ... обещать папа познакомиться мой ладный обижаться саша понимать
